<?xml version="1.0" encoding="UTF-8"?>
<clientes
    xmlns:xsi='http://www.w3.org/2001/XMLSchema-instance'
    xsi:noNamespaceSchemaLocation='clientes.xsd'>
    <cliente DNI="78901234X">
        <apellidos>NADALES</apellidos>
        <CP>44126</CP>
    </cliente>
    <cliente DNI="89012345E">
        <apellidos>ROJAS</apellidos>
        <validez estado="borrado" timestamp="1528286082"/>
    </cliente>
    <cliente DNI="56789012B">
        <apellidos>SAMPER</apellidos>
        <CP>29730</CP>
    </cliente>
</clientes>
